{
  "notice_id": "NOT-AI-26-009",
  "source": "nih",
  "notice_type": "guide_notice",
  "title": "Notice of Early Expiration of PAR-25-316 \"Elucidating Immunometabolic Responses to HIV Infection that Increase TB or HBV Risk (R21 Clinical Trial Not Allowed)\"",
  "release_date": "2026-02-18",
  "url": "https://grants.nih.gov/grants/guide/notice-files/NOT-AI-26-009.html",
  "issuing_orgs": ["National Institute of Allergy and Infectious Diseases"],
  "key_dates": [
    {
      "label": "Release Date",
      "date": "2026-02-18",
      "type": "release"
    }
  ],
  "related": [],
  "raw_html_hash": "18d55619df83a94529f0625fe50554176e0e7ba1bc3612c70f6abfd4523ab594",
  "extracted_at": "2026-05-22T19:38:03Z",
  "extractor_version": "0.1.0"
}
