{
  "notice_id": "NOT-CA-26-012",
  "source": "nih",
  "notice_type": "guide_notice",
  "title": "Notice to Extend the Expiration Date for PAR-25-096 \"Secondary Analysis and Integration of Existing Data to Elucidate Cancer Risk and Related Outcomes (R21 Clinical Trial Not Allowed)\"",
  "release_date": "2026-05-28",
  "url": "https://grants.nih.gov/grants/guide/notice-files/NOT-CA-26-012.html",
  "issuing_orgs": ["National Cancer Institute"],
  "key_dates": [
    {
      "label": "Release Date",
      "date": "2026-05-28",
      "type": "release"
    }
  ],
  "related": [],
  "raw_html_hash": "5bb8427e73838306e1a4cc22d42ce906bbebce024c708cced8b3f38f6c0e9fbb",
  "extracted_at": "2026-06-01T00:07:45Z",
  "extractor_version": "0.1.0"
}
