{
  "notice_id": "NOT-AI-26-006",
  "source": "nih",
  "notice_type": "guide_notice",
  "title": "Notice of Early Expiration of PAR-25-099, \"Planning for Product Development Strategy (R34 Clinical Trial Not Allowed)\"",
  "release_date": "2026-02-19",
  "url": "https://grants.nih.gov/grants/guide/notice-files/NOT-AI-26-006.html",
  "issuing_orgs": ["National Institute of Allergy and Infectious Diseases"],
  "key_dates": [
    {
      "label": "Release Date",
      "date": "2026-02-19",
      "type": "release"
    }
  ],
  "related": [],
  "raw_html_hash": "562d0c1c82dbe1fda1ea791e690bf6067f586a6e7b70bf4075aba9d951056934",
  "extracted_at": "2026-05-22T19:38:02Z",
  "extractor_version": "0.1.0"
}
