{
  "notice_id": "NOT-NS-26-001",
  "source": "nih",
  "notice_type": "change",
  "title": "Notice of Change: NINDS Participation in \"Mentored Research Scientist Development Award (Parent K01)",
  "release_date": "2026-05-26",
  "url": "https://grants.nih.gov/grants/guide/notice-files/NOT-NS-26-001.html",
  "issuing_orgs": ["National Institute of Neurological Disorders and Stroke"],
  "key_dates": [
    {
      "label": "Release Date",
      "date": "2026-05-26",
      "type": "release"
    }
  ],
  "related": [],
  "raw_html_hash": "8b61ec1c3983ca769d4b7112ae58dbc0561c49e24b0b050366067e4bea4c2d38",
  "extracted_at": "2026-06-01T00:07:45Z",
  "extractor_version": "0.1.0"
}
