{
  "notice_id": "NOT-OD-26-075",
  "source": "nih",
  "notice_type": "guide_notice",
  "title": "Notice of Information: Policy changes to SBIR and STTR Discretionary Technical and Business Assistance",
  "release_date": "2026-04-20",
  "url": "https://grants.nih.gov/grants/guide/notice-files/NOT-OD-26-075.html",
  "issuing_orgs": ["NATIONAL INSTITUTES OF HEALTH"],
  "key_dates": [
    {
      "label": "Release Date",
      "date": "2026-04-20",
      "type": "release"
    }
  ],
  "related": ["NOT-OD-24-077"],
  "raw_html_hash": "77fc8cc92a6ef683e8fc149387a89c9af1603d9ff5427aaa855b51e62a408311",
  "extracted_at": "2026-05-22T19:40:20Z",
  "extractor_version": "0.1.0"
}
