{
  "notice_id": "NOT-GM-26-002",
  "source": "nih",
  "notice_type": "guide_notice",
  "title": "Notice of NIGMS Participation in PA-25-422 \"Ruth L. Kirschstein National Research Service Award (NRSA) Individual Predoctoral Fellowship (Parent F31)\"",
  "release_date": "2026-03-19",
  "url": "https://grants.nih.gov/grants/guide/notice-files/NOT-GM-26-002.html",
  "issuing_orgs": ["National Institute of General Medical Sciences"],
  "key_dates": [
    {
      "label": "Release Date",
      "date": "2026-03-19",
      "type": "release"
    }
  ],
  "related": [],
  "raw_html_hash": "880112abd39c323cb2f7c2c9609f8277f66472d77ebd595dfebb9702e7246d21",
  "extracted_at": "2026-05-22T19:38:12Z",
  "extractor_version": "0.1.0"
}
