{
  "notice_id": "NOT-OD-26-078",
  "source": "nih",
  "notice_type": "guide_notice",
  "title": "Update to Standard Language for Developer Terms of Access in the Terms and Conditions of Award",
  "release_date": "2026-04-24",
  "url": "https://grants.nih.gov/grants/guide/notice-files/NOT-OD-26-078.html",
  "issuing_orgs": ["NATIONAL INSTITUTES OF HEALTH"],
  "key_dates": [
    {
      "label": "Release Date",
      "date": "2026-04-24",
      "type": "release"
    }
  ],
  "related": ["NOT-OD-25-159", "NOT-OD-25-021", "NOT-OD-24-157"],
  "raw_html_hash": "75c7931fde335888793b25cb056db6745cf603269db7de6aa09291bdb4001fb3",
  "extracted_at": "2026-05-22T19:40:20Z",
  "extractor_version": "0.1.0"
}
