{
  "notice_id": "NOT-DC-26-006",
  "source": "nih",
  "notice_type": "guide_notice",
  "title": "Notice of Early Expiration of PAR-25-319 \"Advancing HIV/AIDS Research within the Mission of the NIDCD (R01 Clinical Trial Optional)\"",
  "release_date": "2026-06-09",
  "url": "https://grants.nih.gov/grants/guide/notice-files/NOT-DC-26-006.html",
  "issuing_orgs": ["National Institute on Deafness and Other Communication Disorders", "Office of AIDS Research"],
  "key_dates": [
    {
      "label": "Release Date",
      "date": "2026-06-09",
      "type": "release"
    }
  ],
  "related": [],
  "raw_html_hash": "b50d84ab308e5420f5e0840225040293318b5da99f2b50dcdecce25e2ecf2d63",
  "extracted_at": "2026-06-15T00:11:53Z",
  "extractor_version": "0.1.0"
}
