{
  "notice_id": "NOT-OD-26-063",
  "source": "nih",
  "notice_type": "guide_notice",
  "title": "Harmonizing the NIH Definition of “Intervention” with the Common Rule",
  "release_date": "2026-03-27",
  "url": "https://grants.nih.gov/grants/guide/notice-files/NOT-OD-26-063.html",
  "issuing_orgs": ["NATIONAL INSTITUTES OF HEALTH"],
  "key_dates": [
    {
      "label": "Release Date",
      "date": "2026-03-27",
      "type": "release"
    }
  ],
  "related": [],
  "raw_html_hash": "73ed064c195a405806f86db48c7e825e004fadb0feea7af27c7fd546095b8c02",
  "extracted_at": "2026-05-22T19:38:15Z",
  "extractor_version": "0.1.0"
}
