{
  "notice_id": "NOT-HD-26-002",
  "source": "nih",
  "notice_type": "guide_notice",
  "title": "Notice of Extension of the Expiration Date for \"Translational Research in Maternal and Pediatric Pharamacology and Therapeutics (R01 Clinical Trial Optional)\"",
  "release_date": "2026-06-05",
  "url": "https://grants.nih.gov/grants/guide/notice-files/NOT-HD-26-002.html",
  "issuing_orgs": ["Eunice Kennedy Shriver National Institute of Child Health and Human Development"],
  "key_dates": [
    {
      "label": "Release Date",
      "date": "2026-06-05",
      "type": "release"
    }
  ],
  "related": [],
  "raw_html_hash": "212080f747a8e22318812634d26c58eb16b49706ce73162c13359f72c192282e",
  "extracted_at": "2026-06-08T00:10:39Z",
  "extractor_version": "0.1.0"
}
