{
  "notice_id": "NOT-OD-26-041",
  "source": "nih",
  "notice_type": "guide_notice",
  "title": "Findings of Research Misconduct",
  "release_date": "2026-03-17",
  "url": "https://grants.nih.gov/grants/guide/notice-files/NOT-OD-26-041.html",
  "issuing_orgs": ["Office of The Director, National Institutes of Health"],
  "key_dates": [
    {
      "label": "Release Date",
      "date": "2026-03-17",
      "type": "release"
    }
  ],
  "related": [],
  "raw_html_hash": "ca09b95f1be588bef06725d569df776fb3db7fba5505a8f0b473a2383381cf76",
  "extracted_at": "2026-05-22T19:38:12Z",
  "extractor_version": "0.1.0"
}
